{"aspect_ratio":"9:16","duration_seconds":19.933333333333334,"fps":30.0,"height":1920,"metadata":{"canonical_timeline":{"sha256":"19c8e82c1dd3bd4c861ae6c12d3942f4d7841482ba8045f58cc7e90541e7154b","version":2},"content_intelligence":{"approved_brief_sha256":"c90992cd32ad98dd35b06d785ecea412815ce907a431e78a5f7d6801c6854717","content_brief_id":"ca5b01bbb54947a7929a519b23464c3b","content_brief_version":2,"content_idea_id":"0b1e148ba1ad422eb0654b55d5d24b9f","content_idea_version":2,"lineage_sha256":"7616da1f815af1508ec1b32bb1ae57380e6c1ed105fec08e240fff3389f5b6e4","research_run_id":"0a0dd8548ce5421b8a789241a8c36c8d","schema_version":"content-intelligence-lineage-v1","source_references":[{"content_sha256":"1c1edb56e24018cf6e987ed2936554867a9990d5b0b5180698cd6f17b33bec89","id":"01bdc2dc8c3f462cb496a6483ea2fc5d","reference":"https://baochinhphu.vn/gia-chung-cu-neo-cao-bo-xay-dung-tim-co-che-lam-nha-thuong-mai-gia-re-102260424193420829.htm","retrieved_at":"2026-10-05T17:40:46.921165+00:00"}]},"edit_plan_sha256":"ad1e0c0e6a79b4b8c7814636faaaede5ed1b613696e5810ba5817e3b61428aac","human_review_required":true,"timing_source":"measured_narration_audio"},"publish_requested":false,"schema_version":"1.1","source_media_mutated":false,"tracks":[{"clips":[{"asset_id":"ast_d635a3a38d827503f848a68d25bcbe2d","clip_id":"clip_native_01_0000","crop":{"height":1.0,"width":1.0,"x":0.0,"y":0.0},"disabled":false,"duration":3.7333333333333334,"effects":[],"kind":"image","label":"Cảnh 1","metadata":{"fit":"contain","loop_index":0,"motion":"none","native_asset_id":"5b9ddeb053c74778a6c2396b387fde45.jpg","short_source_policy":null,"shot_id":"shot_6c548036ddc45d5291942cf4e32b73ea","source_audio":"muted","source_sha256":"791cfcb48992342416f55560a25a60e955d271e5e12cb0ee28d9494e94dae7de"},"opacity":1.0,"source_end":null,"source_start":0.0,"speed":1.0,"timeline_start":0.0,"transform":{"rotation_degrees":0.0,"scale":1.0,"x":0.0,"y":0.0},"transition_in":{"duration_seconds":0.0,"kind":"cut"},"transition_out":{"duration_seconds":0.0,"kind":"cut"},"volume":1.0},{"asset_id":"ast_fb48309aad5b4574a93bd93f92451da6","clip_id":"clip_native_02_0000","crop":{"height":1.0,"width":1.0,"x":0.0,"y":0.0},"disabled":false,"duration":3.9333333333333336,"effects":[],"kind":"image","label":"Cảnh 2","metadata":{"fit":"contain","loop_index":0,"motion":"none","native_asset_id":"54e7b2146caa483892f2be5f9c0b9650.jpg","short_source_policy":null,"shot_id":"shot_4f01b1e68ed75ef58a7528eea132b838","source_audio":"muted","source_sha256":"fd268a7dfabc3935ac6fae72ab783b78fe50bf4377d23e133d6f3b0ed66b6ca0"},"opacity":1.0,"source_end":null,"source_start":0.0,"speed":1.0,"timeline_start":3.7333333333333334,"transform":{"rotation_degrees":0.0,"scale":1.0,"x":0.0,"y":0.0},"transition_in":{"duration_seconds":0.0,"kind":"cut"},"transition_out":{"duration_seconds":0.0,"kind":"cut"},"volume":1.0},{"asset_id":"ast_f84481b482620af4f245f32376d4ebc8","clip_id":"clip_native_03_0000","crop":{"height":1.0,"width":1.0,"x":0.0,"y":0.0},"disabled":false,"duration":3.4333333333333327,"effects":[],"kind":"image","label":"Cảnh 3","metadata":{"fit":"contain","loop_index":0,"motion":"none","native_asset_id":"b087c5be71214b72aa7d4ca0ed5593a5.jpg","short_source_policy":null,"shot_id":"shot_6a17940579ab51fa95a726e7a90379e5","source_audio":"muted","source_sha256":"86ca52d1e6fd64e85f31b6b58e2d70876a89d5c3f765aa226474b9a81e130a2a"},"opacity":1.0,"source_end":null,"source_start":0.0,"speed":1.0,"timeline_start":7.666666666666667,"transform":{"rotation_degrees":0.0,"scale":1.0,"x":0.0,"y":0.0},"transition_in":{"duration_seconds":0.0,"kind":"cut"},"transition_out":{"duration_seconds":0.0,"kind":"cut"},"volume":1.0},{"asset_id":"ast_d08bdf39a6a2eb415ac50f4661f250c1","clip_id":"clip_native_04_0000","crop":{"height":1.0,"width":1.0,"x":0.0,"y":0.0},"disabled":false,"duration":4.966666666666667,"effects":[],"kind":"image","label":"Cảnh 4","metadata":{"fit":"contain","loop_index":0,"motion":"none","native_asset_id":"735b21b58b9d4bf9aa4472623e658c81.jpg","short_source_policy":null,"shot_id":"shot_443146b227e25756a1684d9720355196","source_audio":"muted","source_sha256":"ee13b6b6bf6d806da0b3b785d592ae81866c64a13753129dc91a837bf8f57d63"},"opacity":1.0,"source_end":null,"source_start":0.0,"speed":1.0,"timeline_start":11.1,"transform":{"rotation_degrees":0.0,"scale":1.0,"x":0.0,"y":0.0},"transition_in":{"duration_seconds":0.0,"kind":"cut"},"transition_out":{"duration_seconds":0.0,"kind":"cut"},"volume":1.0},{"asset_id":"ast_631d3c3520763aff3ad753ba01376d0a","clip_id":"clip_native_05_0000","crop":{"height":1.0,"width":1.0,"x":0.0,"y":0.0},"disabled":false,"duration":3.866666666666667,"effects":[],"kind":"image","label":"Cảnh 5","metadata":{"fit":"contain","loop_index":0,"motion":"none","native_asset_id":"6b9d7fc05dff4d8cb20275ae7cdd6396.jpg","short_source_policy":null,"shot_id":"shot_a254ab21831f538388c965b32ceb5cbe","source_audio":"muted","source_sha256":"d722814025fc75c9551af3df2a87fd6276aeeddc085ecff120740398fc122a5c"},"opacity":1.0,"source_end":null,"source_start":0.0,"speed":1.0,"timeline_start":16.066666666666666,"transform":{"rotation_degrees":0.0,"scale":1.0,"x":0.0,"y":0.0},"transition_in":{"duration_seconds":0.0,"kind":"cut"},"transition_out":{"duration_seconds":0.0,"kind":"cut"},"volume":1.0}],"disabled":false,"kind":"source","label":"Cảnh","locked":false,"muted":false,"order":0,"track_id":"trk_native_video","type":"video"},{"clips":[{"asset_id":null,"clip_id":"clip_caption_0000","crop":{"height":1.0,"width":1.0,"x":0.0,"y":0.0},"disabled":false,"duration":2.21,"effects":[],"kind":"subtitle","label":"Tách ngày đăng khỏi ngày lấy nguồn\nđể đọc đúng thời điểm.","metadata":{"text":"Tách ngày đăng khỏi ngày lấy nguồn\nđể đọc đúng thời điểm.","timing_source":"measured_sentence_activity_weighted_phrase_estimate"},"opacity":1.0,"source_end":2.21,"source_start":0.0,"speed":1.0,"timeline_start":1.2100000000000002,"transform":{"rotation_degrees":0.0,"scale":1.0,"x":0.0,"y":0.0},"transition_in":{"duration_seconds":0.0,"kind":"cut"},"transition_out":{"duration_seconds":0.0,"kind":"cut"},"volume":1.0},{"asset_id":null,"clip_id":"clip_caption_0001","crop":{"height":1.0,"width":1.0,"x":0.0,"y":0.0},"disabled":false,"duration":2.4663157894736845,"effects":[],"kind":"subtitle","label":"Báo Điện tử Chính phủ đăng bài ngày\nhai mươi bốn tháng tư năm hai nghìn","metadata":{"text":"Báo Điện tử Chính phủ đăng bài ngày\nhai mươi bốn tháng tư năm hai nghìn","timing_source":"measured_sentence_activity_weighted_phrase_estimate"},"opacity":1.0,"source_end":2.4663157894736845,"source_start":0.0,"speed":1.0,"timeline_start":3.92,"transform":{"rotation_degrees":0.0,"scale":1.0,"x":0.0,"y":0.0},"transition_in":{"duration_seconds":0.0,"kind":"cut"},"transition_out":{"duration_seconds":0.0,"kind":"cut"},"volume":1.0},{"asset_id":null,"clip_id":"clip_caption_0002","crop":{"height":1.0,"width":1.0,"x":0.0,"y":0.0},"disabled":false,"duration":0.8336842105263154,"effects":[],"kind":"subtitle","label":"không trăm hai mươi sáu.","metadata":{"text":"không trăm hai mươi sáu.","timing_source":"measured_sentence_activity_weighted_phrase_estimate"},"opacity":1.0,"source_end":0.8336842105263154,"source_start":0.0,"speed":1.0,"timeline_start":6.386315789473684,"transform":{"rotation_degrees":0.0,"scale":1.0,"x":0.0,"y":0.0},"transition_in":{"duration_seconds":0.0,"kind":"cut"},"transition_out":{"duration_seconds":0.0,"kind":"cut"},"volume":1.0},{"asset_id":null,"clip_id":"clip_caption_0003","crop":{"height":1.0,"width":1.0,"x":0.0,"y":0.0},"disabled":false,"duration":2.7240789473684197,"effects":[],"kind":"subtitle","label":"Nguồn được lấy ngày sáu tháng mười\ntheo giờ Việt Nam, khác với ngày","metadata":{"text":"Nguồn được lấy ngày sáu tháng mười\ntheo giờ Việt Nam, khác với ngày","timing_source":"measured_sentence_activity_weighted_phrase_estimate"},"opacity":1.0,"source_end":2.7240789473684197,"source_start":0.0,"speed":1.0,"timeline_start":7.72,"transform":{"rotation_degrees":0.0,"scale":1.0,"x":0.0,"y":0.0},"transition_in":{"duration_seconds":0.0,"kind":"cut"},"transition_out":{"duration_seconds":0.0,"kind":"cut"},"volume":1.0},{"asset_id":null,"clip_id":"clip_caption_0004","crop":{"height":1.0,"width":1.0,"x":0.0,"y":0.0},"disabled":false,"duration":0.36592105263157926,"effects":[],"kind":"subtitle","label":"đăng bài.","metadata":{"text":"đăng bài.","timing_source":"measured_sentence_activity_weighted_phrase_estimate"},"opacity":1.0,"source_end":0.36592105263157926,"source_start":0.0,"speed":1.0,"timeline_start":10.44407894736842,"transform":{"rotation_degrees":0.0,"scale":1.0,"x":0.0,"y":0.0},"transition_in":{"duration_seconds":0.0,"kind":"cut"},"transition_out":{"duration_seconds":0.0,"kind":"cut"},"volume":1.0},{"asset_id":null,"clip_id":"clip_caption_0005","crop":{"height":1.0,"width":1.0,"x":0.0,"y":0.0},"disabled":false,"duration":2.739065420560747,"effects":[],"kind":"subtitle","label":"Thông tin trong bài nói về quý một\nnăm hai nghìn không trăm hai mươi","metadata":{"text":"Thông tin trong bài nói về quý một\nnăm hai nghìn không trăm hai mươi","timing_source":"measured_sentence_activity_weighted_phrase_estimate"},"opacity":1.0,"source_end":2.739065420560747,"source_start":0.0,"speed":1.0,"timeline_start":11.310000000000002,"transform":{"rotation_degrees":0.0,"scale":1.0,"x":0.0,"y":0.0},"transition_in":{"duration_seconds":0.0,"kind":"cut"},"transition_out":{"duration_seconds":0.0,"kind":"cut"},"volume":1.0},{"asset_id":null,"clip_id":"clip_caption_0006","crop":{"height":1.0,"width":1.0,"x":0.0,"y":0.0},"disabled":false,"duration":1.5709345794392515,"effects":[],"kind":"subtitle","label":"sáu, chưa xác nhận thị trường hiện\ntại.","metadata":{"text":"sáu, chưa xác nhận thị trường hiện\ntại.","timing_source":"measured_sentence_activity_weighted_phrase_estimate"},"opacity":1.0,"source_end":1.5709345794392515,"source_start":0.0,"speed":1.0,"timeline_start":14.04906542056075,"transform":{"rotation_degrees":0.0,"scale":1.0,"x":0.0,"y":0.0},"transition_in